[
  {
    "date": "2026-01-01",
    "mood_score": 0.61,
    "primary_emotion": "无聊",
    "stress_level": 4,
    "sleep_hours": 7.7,
    "sleep_time": "21:33",
    "wake_time": "05:45",
    "journal_keywords": [
      "游戏",
      "漫画"
    ],
    "journal_snippet": "放学后和几个同学去小卖部买了零食。"
  },
  {
    "date": "2026-01-02",
    "mood_score": 0.63,
    "primary_emotion": "开心",
    "stress_level": 3,
    "sleep_hours": 7.9,
    "sleep_time": "22:23",
    "wake_time": "06:05",
    "journal_keywords": [
      "作业",
      "上课"
    ],
    "journal_snippet": "物理课打瞌睡被老师点名了，好丢脸。"
  },
  {
    "date": "2026-01-03",
    "mood_score": 0.54,
    "primary_emotion": "平静",
    "stress_level": 5,
    "sleep_hours": 7.8,
    "sleep_time": "21:48",
    "wake_time": "06:09",
    "journal_keywords": [
      "同学",
      "作业"
    ],
    "journal_snippet": "物理课打瞌睡被老师点名了，好丢脸。"
  },
  {
    "date": "2026-01-04",
    "mood_score": 0.71,
    "primary_emotion": "期待",
    "stress_level": 4,
    "sleep_hours": 7.8,
    "sleep_time": "21:37",
    "wake_time": "06:01",
    "journal_keywords": [
      "打球",
      "考试"
    ],
    "journal_snippet": "数学题好难，想了半天才做出来。"
  },
  {
    "date": "2026-01-05",
    "mood_score": 0.68,
    "primary_emotion": "平静",
    "stress_level": 5,
    "sleep_hours": 7.6,
    "sleep_time": "22:06",
    "wake_time": "05:52",
    "journal_keywords": [
      "漫画",
      "考试",
      "作业"
    ],
    "journal_snippet": "数学题好难，想了半天才做出来。"
  },
  {
    "date": "2026-01-06",
    "mood_score": 0.65,
    "primary_emotion": "满足",
    "stress_level": 6,
    "sleep_hours": 7.8,
    "sleep_time": "22:12",
    "wake_time": "05:46",
    "journal_keywords": [
      "同学",
      "打球"
    ],
    "journal_snippet": "数学题好难，想了半天才做出来。"
  },
  {
    "date": "2026-01-07",
    "mood_score": 0.74,
    "primary_emotion": "开心",
    "stress_level": 6,
    "sleep_hours": 7.1,
    "sleep_time": "21:54",
    "wake_time": "05:55",
    "journal_keywords": [
      "游戏"
    ],
    "journal_snippet": "物理课打瞌睡被老师点名了，好丢脸。"
  },
  {
    "date": "2026-01-08",
    "mood_score": 0.68,
    "primary_emotion": "疲惫",
    "stress_level": 5,
    "sleep_hours": 7.1,
    "sleep_time": "21:53",
    "wake_time": "05:55",
    "journal_keywords": [
      "上课",
      "作业",
      "漫画"
    ],
    "journal_snippet": "今天课间和同桌打了会儿羽毛球，挺开心的。"
  },
  {
    "date": "2026-01-09",
    "mood_score": 0.66,
    "primary_emotion": "期待",
    "stress_level": 6,
    "sleep_hours": 7.1,
    "sleep_time": "22:10",
    "wake_time": "05:58",
    "journal_keywords": [
      "游戏",
      "漫画",
      "上课"
    ],
    "journal_snippet": "周末想打游戏但是作业好多。"
  },
  {
    "date": "2026-01-10",
    "mood_score": 0.65,
    "primary_emotion": "期待",
    "stress_level": 4,
    "sleep_hours": 7.9,
    "sleep_time": "22:17",
    "wake_time": "06:18",
    "journal_keywords": [
      "周末"
    ],
    "journal_snippet": "周末想打游戏但是作业好多。"
  },
  {
    "date": "2026-01-11",
    "mood_score": 0.6,
    "primary_emotion": "疲惫",
    "stress_level": 6,
    "sleep_hours": 7.7,
    "sleep_time": "22:13",
    "wake_time": "06:18",
    "journal_keywords": [
      "打球"
    ],
    "journal_snippet": "英语老师表扬我了，作文写得不错。"
  },
  {
    "date": "2026-01-12",
    "mood_score": 0.63,
    "primary_emotion": "满足",
    "stress_level": 5,
    "sleep_hours": 6.8,
    "sleep_time": "22:23",
    "wake_time": "06:15",
    "journal_keywords": [
      "上课"
    ],
    "journal_snippet": "放学后和几个同学去小卖部买了零食。"
  },
  {
    "date": "2026-01-13",
    "mood_score": 0.64,
    "primary_emotion": "满足",
    "stress_level": 4,
    "sleep_hours": 6.9,
    "sleep_time": "21:43",
    "wake_time": "06:17",
    "journal_keywords": [
      "同学",
      "漫画"
    ],
    "journal_snippet": "物理课打瞌睡被老师点名了，好丢脸。"
  },
  {
    "date": "2026-01-14",
    "mood_score": 0.52,
    "primary_emotion": "期待",
    "stress_level": 6,
    "sleep_hours": 7.8,
    "sleep_time": "21:59",
    "wake_time": "06:16",
    "journal_keywords": [
      "考试"
    ],
    "journal_snippet": "今天课间和同桌打了会儿羽毛球，挺开心的。"
  },
  {
    "date": "2026-01-15",
    "mood_score": 0.63,
    "primary_emotion": "期待",
    "stress_level": 5,
    "sleep_hours": 7.6,
    "sleep_time": "21:43",
    "wake_time": "06:17",
    "journal_keywords": [
      "上课",
      "漫画"
    ],
    "journal_snippet": "英语老师表扬我了，作文写得不错。"
  },
  {
    "date": "2026-01-16",
    "mood_score": 0.51,
    "primary_emotion": "满足",
    "stress_level": 5,
    "sleep_hours": 7.6,
    "sleep_time": "22:29",
    "wake_time": "06:10",
    "journal_keywords": [
      "同学"
    ],
    "journal_snippet": "今天课间和同桌打了会儿羽毛球，挺开心的。"
  },
  {
    "date": "2026-01-17",
    "mood_score": 0.57,
    "primary_emotion": "疲惫",
    "stress_level": 4,
    "sleep_hours": 7.7,
    "sleep_time": "21:58",
    "wake_time": "06:04",
    "journal_keywords": [
      "考试",
      "作业",
      "打球"
    ],
    "journal_snippet": "班主任找我谈话说最近状态不错。"
  },
  {
    "date": "2026-01-18",
    "mood_score": 0.52,
    "primary_emotion": "无聊",
    "stress_level": 4,
    "sleep_hours": 7.5,
    "sleep_time": "22:04",
    "wake_time": "06:05",
    "journal_keywords": [
      "作业"
    ],
    "journal_snippet": "数学题好难，想了半天才做出来。"
  },
  {
    "date": "2026-01-19",
    "mood_score": 0.67,
    "primary_emotion": "平静",
    "stress_level": 4,
    "sleep_hours": 7.8,
    "sleep_time": "22:16",
    "wake_time": "06:14",
    "journal_keywords": [
      "周末",
      "漫画"
    ],
    "journal_snippet": "班主任找我谈话说最近状态不错。"
  },
  {
    "date": "2026-01-20",
    "mood_score": 0.63,
    "primary_emotion": "无聊",
    "stress_level": 4,
    "sleep_hours": 7.0,
    "sleep_time": "21:42",
    "wake_time": "05:47",
    "journal_keywords": [
      "游戏"
    ],
    "journal_snippet": "今天课间和同桌打了会儿羽毛球，挺开心的。"
  },
  {
    "date": "2026-01-21",
    "mood_score": 0.69,
    "primary_emotion": "平静",
    "stress_level": 6,
    "sleep_hours": 7.5,
    "sleep_time": "21:34",
    "wake_time": "05:46",
    "journal_keywords": [
      "打球"
    ],
    "journal_snippet": "今天课间和同桌打了会儿羽毛球，挺开心的。"
  },
  {
    "date": "2026-01-22",
    "mood_score": 0.61,
    "primary_emotion": "平静",
    "stress_level": 3,
    "sleep_hours": 7.0,
    "sleep_time": "22:04",
    "wake_time": "05:53",
    "journal_keywords": [
      "周末",
      "同学"
    ],
    "journal_snippet": "今天课间和同桌打了会儿羽毛球，挺开心的。"
  },
  {
    "date": "2026-01-23",
    "mood_score": 0.53,
    "primary_emotion": "疲惫",
    "stress_level": 5,
    "sleep_hours": 7.0,
    "sleep_time": "22:19",
    "wake_time": "06:00",
    "journal_keywords": [
      "漫画",
      "游戏",
      "考试"
    ],
    "journal_snippet": "放学后和几个同学去小卖部买了零食。"
  },
  {
    "date": "2026-01-24",
    "mood_score": 0.57,
    "primary_emotion": "满足",
    "stress_level": 4,
    "sleep_hours": 8.0,
    "sleep_time": "21:49",
    "wake_time": "05:57",
    "journal_keywords": [
      "考试"
    ],
    "journal_snippet": "今天课间和同桌打了会儿羽毛球，挺开心的。"
  },
  {
    "date": "2026-01-25",
    "mood_score": 0.63,
    "primary_emotion": "期待",
    "stress_level": 4,
    "sleep_hours": 7.5,
    "sleep_time": "22:30",
    "wake_time": "06:04",
    "journal_keywords": [
      "周末",
      "上课",
      "作业"
    ],
    "journal_snippet": "周末想打游戏但是作业好多。"
  },
  {
    "date": "2026-01-26",
    "mood_score": 0.67,
    "primary_emotion": "期待",
    "stress_level": 6,
    "sleep_hours": 6.9,
    "sleep_time": "21:45",
    "wake_time": "05:54",
    "journal_keywords": [
      "周末"
    ],
    "journal_snippet": "今天体育课跑了800米，累死了。"
  },
  {
    "date": "2026-01-27",
    "mood_score": 0.71,
    "primary_emotion": "平静",
    "stress_level": 4,
    "sleep_hours": 7.7,
    "sleep_time": "22:03",
    "wake_time": "05:48",
    "journal_keywords": [
      "考试",
      "打球",
      "游戏"
    ],
    "journal_snippet": "班主任找我谈话说最近状态不错。"
  },
  {
    "date": "2026-01-28",
    "mood_score": 0.56,
    "primary_emotion": "平静",
    "stress_level": 4,
    "sleep_hours": 7.1,
    "sleep_time": "22:04",
    "wake_time": "05:52",
    "journal_keywords": [
      "漫画",
      "上课"
    ],
    "journal_snippet": "今天课间和同桌打了会儿羽毛球，挺开心的。"
  },
  {
    "date": "2026-01-29",
    "mood_score": 0.56,
    "primary_emotion": "开心",
    "stress_level": 3,
    "sleep_hours": 7.8,
    "sleep_time": "22:25",
    "wake_time": "06:01",
    "journal_keywords": [
      "打球",
      "周末",
      "同学"
    ],
    "journal_snippet": "今天体育课跑了800米，累死了。"
  },
  {
    "date": "2026-01-30",
    "mood_score": 0.73,
    "primary_emotion": "开心",
    "stress_level": 3,
    "sleep_hours": 7.0,
    "sleep_time": "22:28",
    "wake_time": "05:55",
    "journal_keywords": [
      "同学",
      "漫画",
      "打球"
    ],
    "journal_snippet": "放学后和几个同学去小卖部买了零食。"
  },
  {
    "date": "2026-01-31",
    "mood_score": 0.6,
    "primary_emotion": "无聊",
    "stress_level": 4,
    "sleep_hours": 7.4,
    "sleep_time": "22:11",
    "wake_time": "06:02",
    "journal_keywords": [
      "周末",
      "游戏"
    ],
    "journal_snippet": "今天体育课跑了800米，累死了。"
  },
  {
    "date": "2026-02-01",
    "mood_score": 0.56,
    "primary_emotion": "疲惫",
    "stress_level": 6,
    "sleep_hours": 7.3,
    "sleep_time": "21:53",
    "wake_time": "06:00",
    "journal_keywords": [
      "漫画",
      "同学"
    ],
    "journal_snippet": "班主任找我谈话说最近状态不错。"
  },
  {
    "date": "2026-02-02",
    "mood_score": 0.51,
    "primary_emotion": "平静",
    "stress_level": 4,
    "sleep_hours": 7.7,
    "sleep_time": "21:39",
    "wake_time": "05:52",
    "journal_keywords": [
      "考试",
      "作业"
    ],
    "journal_snippet": "周末想打游戏但是作业好多。"
  },
  {
    "date": "2026-02-03",
    "mood_score": 0.56,
    "primary_emotion": "疲惫",
    "stress_level": 4,
    "sleep_hours": 7.3,
    "sleep_time": "22:16",
    "wake_time": "06:11",
    "journal_keywords": [
      "漫画",
      "作业",
      "打球"
    ],
    "journal_snippet": "物理课打瞌睡被老师点名了，好丢脸。"
  },
  {
    "date": "2026-02-04",
    "mood_score": 0.54,
    "primary_emotion": "疲惫",
    "stress_level": 5,
    "sleep_hours": 6.9,
    "sleep_time": "22:11",
    "wake_time": "05:43",
    "journal_keywords": [
      "周末",
      "同学",
      "游戏"
    ],